{
  "$schema": "https://json-schema.org/draft/2020-12/schema",
  "$id": "https://the-pass.dev/schemas/verdict_report.schema.json",
  "title": "VerdictReport",
  "type": "object",
  "required": ["id", "run_receipt", "created_at", "verdict", "summary", "gate_results", "evidence", "risks", "next_action"],
  "properties": {
    "id": { "type": "string", "minLength": 1 },
    "run_receipt": { "type": "string" },
    "created_at": { "type": "string" },
    "owner": { "type": "string" },
    "verdict": { "type": "string", "enum": ["kill", "revise", "paper_candidate", "blocked"] },
    "summary": { "type": "string" },
    "gate_results": { "type": "object" },
    "evidence": { "type": "object" },
    "risks": { "type": "object" },
    "next_action": { "type": "string" },
    "kill_reason": { "type": "string" },
    "review_required_by": { "type": "array", "items": { "type": "string" } }
  },
  "additionalProperties": true
}
