{
  "id": "synthetic-random-baseline-verdict-v0",
  "run_receipt": "run_receipt.json",
  "created_at": "2026-07-09T00:00:00Z",
  "owner": "the-pass",
  "verdict": "kill",
  "summary": "The random-signal fixture validates the negative-control path and must not be promoted.",
  "gate_results": {
    "universal_hard_gates": ["artifact package present", "safety flags false"],
    "asset_class_gates": ["synthetic diagnostic only"],
    "failed_gates": ["no edge thesis", "negative net result after illustrative costs"]
  },
  "evidence": {
    "metrics_report": "metrics_report.json",
    "cost_waterfall": "cost_waterfall.json",
    "data_manifest": "data_manifest.json",
    "source_notes": ["source_note.json"]
  },
  "risks": {
    "statistical": ["Random signal has no explanatory mechanism"],
    "execution": ["No fills"],
    "data": ["Synthetic only"],
    "operational": ["None; no live path"]
  },
  "next_action": "Keep as CI negative-control fixture.",
  "kill_reason": "Random direction rule has no edge thesis and fails net-of-cost evidence.",
  "review_required_by": []
}
